pregunta,respuesta
¿Tienen impresora o fotocopiadora?,"Sí, contamos con servicio de impresión y fotocopiado a $1 peso por hoja en blanco y negro."
¿Puedo reservar una sala de estudio?,"Sí, puedes reservar una sala de estudio grupal por hasta 2 horas presentándote en el mostrador de atención."
¿Aceptan donaciones de libros?,"Sí, aceptamos donaciones de libros en buen estado. Puedes entregarlos directamente al personal en el mostrador."
¿Hay estacionamiento disponible?,"Sí, la biblioteca cuenta con estacionamiento gratuito para visitantes en la parte trasera del edificio."
¿Ofrecen acceso a internet?,"Sí, ofrecemos WiFi gratuito y también contamos con computadoras de uso público con límite de 1 hora por persona."
¿Puedo consultar libros sin ser socio?,"Sí, la consulta en sala es libre y gratuita para cualquier persona, solo el préstamo a domicilio requiere credencial."
